{
  "$schema": "https://json-schema.org/draft/2020-12/schema",
  "$id": "interface.schema.json",
  "title": "Interface Spec — derivado de 07_interface_pedagogo.md v0.4.0",
  "type": "object",
  "required": [
    "meta", "access_point", "servidor_http", "websocket",
    "protocolo_mensagens", "configuracao_ui", "estados_interface",
    "feedback_visual", "feedback_sonoro", "armazenamento",
    "exportacao_csv", "exportacao_ui", "exportacao_pdf", "criterios_aceitacao"
  ],
  "additionalProperties": false,

  "definitions": {

    "modo_enum": {
      "type": "string",
      "enum": ["UM_MARTELO", "DOIS_MARTELOS"]
    },

    "mecanismo_enum": {
      "type": "string",
      "enum": ["A_SHUFFLE", "B_PESO"]
    },

    "tipo_js_enum": {
      "type": "string",
      "enum": ["string", "integer", "number", "boolean"]
    },

    "campo_mensagem": {
      "type": "object",
      "required": ["nome", "tipo_c"],
      "additionalProperties": true,
      "properties": {
        "nome":           {"type": "string", "minLength": 1},
        "tipo_c":         {"type": "string"},
        "valor_fixo":     {"type": "string"},
        "valores_validos":{"type": "array", "items": {"type": "string"}, "minItems": 2},
        "minimo":         {"type": "integer"},
        "padrao":         {"type": "integer"}
      }
    },

    "mensagem_ws": {
      "type": "object",
      "required": ["tipo", "campos"],
      "additionalProperties": false,
      "properties": {
        "tipo": {"type": "string", "minLength": 1},
        "campos": {
          "type": "array",
          "minItems": 1,
          "items": {"$ref": "#/definitions/campo_mensagem"}
        }
      }
    }

  },

  "properties": {

    "meta": {
      "type": "object",
      "required": ["documento_fonte", "versao_fonte", "depende_de"],
      "additionalProperties": false,
      "properties": {
        "documento_fonte": {"type": "string"},
        "versao_fonte":    {"type": "string", "pattern": "^\\d+\\.\\d+\\.\\d+$"},
        "depende_de":      {"type": "array", "items": {"type": "string"}, "minItems": 1}
      }
    },

    "access_point": {
      "type": "object",
      "required": ["ssid", "senha_obrigatoria", "ip", "canal"],
      "additionalProperties": false,
      "properties": {
        "ssid":              {"type": "string", "minLength": 1},
        "senha_obrigatoria": {"type": "boolean"},
        "ip":                {"type": "string", "pattern": "^\\d{1,3}\\.\\d{1,3}\\.\\d{1,3}\\.\\d{1,3}$"},
        "canal":             {"type": "integer", "minimum": 1, "maximum": 13}
      }
    },

    "servidor_http": {
      "type": "object",
      "required": ["biblioteca", "rotas"],
      "additionalProperties": false,
      "properties": {
        "biblioteca": {"type": "string"},
        "rotas": {
          "type": "array",
          "minItems": 2,
          "maxItems": 2,
          "items": {
            "type": "object",
            "required": ["rota", "metodo", "tipo_resposta"],
            "additionalProperties": false,
            "properties": {
              "rota":          {"type": "string"},
              "metodo":        {"type": "string"},
              "tipo_resposta": {"type": "string"}
            }
          }
        }
      }
    },

    "websocket": {
      "type": "object",
      "required": ["url", "latencia_max_evento_tela_ms", "formato_mensagem", "acao_desconexao", "acao_reconexao"],
      "additionalProperties": false,
      "properties": {
        "url":                         {"type": "string"},
        "latencia_max_evento_tela_ms": {"type": "integer", "const": 200},
        "formato_mensagem":            {"type": "string",  "const": "JSON"},
        "acao_desconexao":             {"type": "string"},
        "acao_reconexao":              {"type": "string"}
      }
    },

    "protocolo_mensagens": {
      "type": "object",
      "required": ["browser_para_esp32", "esp32_para_browser"],
      "additionalProperties": false,
      "properties": {
        "browser_para_esp32": {
          "type": "array",
          "minItems": 4,
          "maxItems": 4,
          "items": {"$ref": "#/definitions/mensagem_ws"}
        },
        "esp32_para_browser": {
          "type": "array",
          "minItems": 5,
          "maxItems": 5,
          "items": {"$ref": "#/definitions/mensagem_ws"}
        }
      }
    },

    "configuracao_ui": {
      "type": "object",
      "required": ["modo_padrao", "mecanismo_padrao", "janela_ms_padrao", "janela_ms_visivel_modo2", "n_interacoes_min", "nome_obrigatorio"],
      "additionalProperties": false,
      "properties": {
        "modo_padrao":             {"$ref": "#/definitions/modo_enum"},
        "mecanismo_padrao":        {"$ref": "#/definitions/mecanismo_enum"},
        "janela_ms_padrao":        {"type": "integer", "const": 800},
        "janela_ms_visivel_modo2": {"type": "boolean", "const": true},
        "n_interacoes_min":        {"type": "integer", "const": 1},
        "nome_obrigatorio":        {"type": "boolean", "const": true}
      }
    },

    "estados_interface": {
      "type": "object",
      "required": ["lista", "duracao_feedback_acerto_ms", "feedback_erro_dura_ate_proximo_evento"],
      "additionalProperties": false,
      "properties": {
        "lista": {
          "type": "array",
          "minItems": 6,
          "maxItems": 6,
          "items": {"type": "string"}
        },
        "duracao_feedback_acerto_ms":           {"type": "integer", "const": 1500},
        "feedback_erro_dura_ate_proximo_evento": {"type": "boolean", "const": true}
      }
    },

    "feedback_visual": {
      "type": "object",
      "required": ["acerto_cor_hex", "acerto_duracao_ms", "erro_cor_hex", "implementacao"],
      "additionalProperties": false,
      "properties": {
        "acerto_cor_hex":    {"type": "string", "pattern": "^#[0-9A-Fa-f]{6}$"},
        "acerto_duracao_ms": {"type": "integer", "const": 1500},
        "erro_cor_hex":      {"type": "string", "pattern": "^#[0-9A-Fa-f]{6}$"},
        "implementacao":     {"type": "string"}
      }
    },

    "feedback_sonoro": {
      "type": "object",
      "required": ["api", "acerto", "erro"],
      "additionalProperties": false,
      "properties": {
        "api": {"type": "string"},
        "acerto": {
          "type": "object",
          "required": ["frequencias_hz", "duracao_por_tom_ms", "offset_entre_tons_ms", "attack_ms", "release_ms", "ganho"],
          "additionalProperties": false,
          "properties": {
            "frequencias_hz":       {"type": "array", "minItems": 2, "maxItems": 2, "items": {"type": "integer", "exclusiveMinimum": 0}},
            "duracao_por_tom_ms":   {"type": "integer", "exclusiveMinimum": 0},
            "offset_entre_tons_ms": {"type": "integer", "exclusiveMinimum": 0},
            "attack_ms":            {"type": "integer", "exclusiveMinimum": 0},
            "release_ms":           {"type": "integer", "exclusiveMinimum": 0},
            "ganho":                {"type": "number",  "exclusiveMinimum": 0, "maximum": 1}
          }
        },
        "erro": {
          "type": "object",
          "required": ["frequencia_hz", "duracao_ms", "attack_ms", "release_ms", "ganho"],
          "additionalProperties": false,
          "properties": {
            "frequencia_hz": {"type": "integer", "exclusiveMinimum": 0},
            "duracao_ms":    {"type": "integer", "exclusiveMinimum": 0},
            "attack_ms":     {"type": "integer", "exclusiveMinimum": 0},
            "release_ms":    {"type": "integer", "exclusiveMinimum": 0},
            "ganho":         {"type": "number",  "exclusiveMinimum": 0, "maximum": 1}
          }
        }
      }
    },

    "armazenamento": {
      "type": "object",
      "required": ["tecnologia", "chave", "estrutura", "campos_registro"],
      "additionalProperties": false,
      "properties": {
        "tecnologia": {"type": "string", "const": "localStorage"},
        "chave":      {"type": "string", "const": "bmi_sessoes"},
        "estrutura":  {"type": "string"},
        "campos_registro": {
          "type": "array",
          "minItems": 10,
          "maxItems": 10,
          "items": {
            "type": "object",
            "required": ["nome", "tipo_js"],
            "additionalProperties": true,
            "properties": {
              "nome":    {"type": "string", "minLength": 1},
              "tipo_js": {"$ref": "#/definitions/tipo_js_enum"}
            }
          }
        }
      }
    },

    "exportacao_csv": {
      "type": "object",
      "required": ["cabecalho", "nome_arquivo", "tipo_mime", "charset", "bom", "escaping_rfc4180", "exporta_todos"],
      "additionalProperties": false,
      "properties": {
        "cabecalho":        {"type": "string", "minLength": 1},
        "nome_arquivo":     {"type": "string", "pattern": "\\.csv$"},
        "tipo_mime":        {"type": "string", "const": "text/csv"},
        "charset":          {"type": "string", "const": "utf-8"},
        "bom":              {"type": "string", "const": "\uFEFF"},
        "escaping_rfc4180": {"type": "boolean", "const": true},
        "exporta_todos":    {"type": "boolean", "const": true}
      }
    },

    "exportacao_ui": {
      "type": "object",
      "required": ["formatos", "formato_padrao", "pre_visualizacao", "confirmacao_obrigatoria", "baixar_desabilitado_vazio"],
      "additionalProperties": false,
      "properties": {
        "formatos": {
          "type": "array",
          "minItems": 2,
          "maxItems": 2,
          "items": {"type": "string", "enum": ["CSV", "PDF"]}
        },
        "formato_padrao":            {"type": "string", "const": "CSV"},
        "pre_visualizacao":          {"type": "boolean", "const": true},
        "confirmacao_obrigatoria":   {"type": "boolean", "const": true},
        "baixar_desabilitado_vazio": {"type": "boolean", "const": true}
      }
    },

    "exportacao_pdf": {
      "type": "object",
      "required": ["nome_arquivo", "tipo_mime", "versao_pdf", "titulo", "encoding",
                   "formato_data_geracao", "fontes", "pagina", "altura_linha_pt",
                   "espaco_pos_titulo_pt", "espaco_pos_meta_pt",
                   "linhas_dados_por_pagina", "colunas", "exporta_todos"],
      "additionalProperties": false,
      "properties": {
        "nome_arquivo":         {"type": "string", "pattern": "\\.pdf$"},
        "tipo_mime":            {"type": "string", "const": "application/pdf"},
        "versao_pdf":           {"type": "string", "const": "1.4"},
        "titulo":               {"type": "string", "minLength": 1},
        "encoding":             {"type": "string", "const": "WinAnsiEncoding"},
        "formato_data_geracao": {"type": "string", "const": "dd/mm/aaaa hh:mm"},
        "fontes": {
          "type": "object",
          "required": ["titulo", "metadados", "tabela"],
          "additionalProperties": false,
          "properties": {
            "titulo": {
              "type": "object",
              "required": ["nome", "tamanho_pt"],
              "additionalProperties": false,
              "properties": {
                "nome":       {"type": "string", "const": "Helvetica-Bold"},
                "tamanho_pt": {"type": "integer", "const": 16}
              }
            },
            "metadados": {
              "type": "object",
              "required": ["nome", "tamanho_pt"],
              "additionalProperties": false,
              "properties": {
                "nome":       {"type": "string", "const": "Helvetica"},
                "tamanho_pt": {"type": "integer", "const": 10}
              }
            },
            "tabela": {
              "type": "object",
              "required": ["nome", "tamanho_pt", "largura_char_fator"],
              "additionalProperties": false,
              "properties": {
                "nome":               {"type": "string", "const": "Courier"},
                "tamanho_pt":         {"type": "integer", "const": 8},
                "largura_char_fator": {"type": "number", "const": 0.6}
              }
            }
          }
        },
        "pagina": {
          "type": "object",
          "required": ["largura_pt", "altura_pt", "margem_pt"],
          "additionalProperties": false,
          "properties": {
            "largura_pt": {"type": "integer", "const": 842},
            "altura_pt":  {"type": "integer", "const": 595},
            "margem_pt":  {"type": "integer", "const": 40}
          }
        },
        "altura_linha_pt":         {"type": "integer", "const": 12},
        "espaco_pos_titulo_pt":    {"type": "integer", "const": 20},
        "espaco_pos_meta_pt":      {"type": "integer", "const": 24},
        "linhas_dados_por_pagina": {"type": "integer", "const": 35},
        "colunas": {
          "type": "array",
          "minItems": 10,
          "maxItems": 10,
          "items": {
            "type": "object",
            "required": ["campo", "titulo", "largura_chars"],
            "additionalProperties": false,
            "properties": {
              "campo":         {"type": "string", "minLength": 1},
              "titulo":        {"type": "string", "minLength": 1},
              "largura_chars": {"type": "integer", "minimum": 4}
            }
          }
        },
        "exporta_todos": {"type": "boolean", "const": true}
      }
    },

    "criterios_aceitacao": {
      "type": "array",
      "minItems": 14,
      "maxItems": 14,
      "items": {
        "type": "object",
        "required": ["id"],
        "additionalProperties": true,
        "properties": {
          "id": {"type": "string", "pattern": "^CA-07-[0-9]{2}$"}
        }
      }
    }

  }
}
